,city,position,company_name,company_size,company_type,salary,education,ability,experience
0,广州,数据分析师,广州瑟蒂渃服饰有限公司,100-299人,民营,4千-5千,本科,数据仓库 数据分析 数据集市 需求分析 ,1-3年
1,广州,数据分析师,广州巴伽娱乐传媒有限公司,100-299人,合资,5千-8千,大专,数据分析 ,1-3年
2,广州-天河区,业务数据分析师(J10404),中康资讯,300-499人,民营,1万-1.5万,本科,销售业务数据 ,3-5年
3,广州-越秀区,商业数据分析师,广州博晓智盈管理咨询有限公司,20人以下,民营,1.1万-1.6万,本科,商业分析 数据挖掘 数据采集 数据建模 ,3-5年
4,广州-越秀区,数据分析师,广州巴博瑞汽车零部件有限公司,100-299人,民营,5千-9千,大专,数据分析 数据挖掘 SPSS 行业分析 ,1-3年
5,广州,数据分析师,广州集优电子商务有限公司,100-299人,民营,7千-1万,大专,数据分析 数据采集 VBA 数据挖掘 数据监控 数据架构 ,1-3年
6,广州,数据分析师,广州市大鸽饭餐饮服务有限公司,500-999人,民营,1万-1.8万,大专,数据分析 ,1-3年
7,广州,数据分析师,广东尚源信息技术有限公司,100-299人,民营,7千-1万,本科,数据分析 数据建模 SQL ,1-3年
8,广州,数据分析师,广州智数信息技术有限公司,20-99人,民营,7千-1.2万,本科,数据建模 Python 数据清洗 SQL Oracle SQLServer 数据仓库 ,1-3年
9,广州,数据分析师,康立明生物,500-999人,民营,1万-1.8万,本科,数据分析 ,3-5年
10,广州-白云区,双休大数据分析师/本科学历,西安橄榄枝人力资源有限公司,100-299人,民营,7千-1万,本科,Oracle 数据分析 ,1年以下
11,广州-黄埔区,数据分析师,佰聆数据股份有限公司北京分公司,100-299人,民营,8千-1.5万,本科,数据分析 Greenplum ,3-5年
12,广州,数据分析师,深圳科迪新汇信息科技有限公司广州分公司,100-299人,民营,8千-1.5万,本科,数据分析 数据挖掘 数据清洗 数据建模 ,1-3年
13,广州,数据分析师助理,广州星晨互联网信息有限公司,20-99人,股份制企业,6千-9千,学历不限,数据分析 SQL Python ,不限
14,广州-天河区,初级数据分析师,广州智嘉科技有限公司,20-99人,合资,4千-8千,大专,SQL 商业分析 数据采集 需求分析 数据挖掘 Python ,不限
15,广州,数据分析师,中国联通广东分公司,1000-9999人,国企,1.3万-2.3万,本科,SQL Python 数据挖掘 数据建模 需求分析 Oracle ,1-3年
16,广州-黄埔区,数据分析师 （数据运营方向）,广州宏途教育网络科技有限公司,100-299人,民营,8千-1万,本科,数据分析 数据挖掘 大数据分析 大数据平台 ,1-3年
17,广州-天河区,数据分析师,广州天维信息技术股份有限公司,500-999人,股份制企业,8千-1.6万,本科,SPSS Python ,3-5年
18,广州-天河区,数据分析师,深圳市浪花网络科技有限公司,500-999人,民营,1万-1.5万,大专,数据分析 数据挖掘 Tableau 需求分析 ,1-3年
19,广州-天河区,数据分析师,启迪万众网络科技(北京)有限公司,20-99人,民营,7千-9千,本科,数据分析 Python SQL 爬虫 ,1-3年
20,广州-天河区,数据分析师,神州泰岳,1000-9999人,民营,9千-1万,大专,excel 数据分析 Python SQL ,3-5年
21,广州-白云区,数据分析师,广州欧博化妆品有限公司,500-999人,民营,6千-1万,大专,数据分析 大数据分析 数据治理 大数据平台 爬虫 商业分析 ,不限
22,广州,数据分析师,百度在线网络技术(北京)有限公司上海软件技术分公司,1000-9999人,上市公司,1万-1.5万,本科,数据分析 Python SQL 商业分析 商业数据分析 行业分析 ,1-3年
23,广州-荔湾区,数据分析师,名创优品,10000人以上,民营,8千-1.2万,本科,Python MySQL Tableau ,1-3年
24,广州-番禺区,商品数据分析师 (MJ000511),广州细刻网络科技有限公司,500-999人,民营,8千-1.3万,本科,数据分析 ,不限
25,广州-越秀区,数据分析师,台州市大数据发展有限公司,100-299人,国企,1.3万-1.8万,硕士,Hadoop Spark BI 数据分析 数据挖掘 数据清洗 大数据分析 需求分析 ,1-3年
26,广州-白云区,数据分析师,广州市爱莲化妆品有限公司,20-99人,民营,4千-6千,本科,数据分析 数据挖掘 SPSS 数据仓库 大数据分析 ,不限
27,广州-海珠区,数据分析师,保利地产投资顾问有限公司,1000-9999人,国企,2万-3万,本科,数据分析 ,5-10年
28,广州,数据分析师,名创优品,10000人以上,民营,1.5万-2.5万,本科,Python BI SQL Tableau 商业数据分析 需求分析 ,3-5年
29,广州-荔湾区,高级数据分析师,唯品会,10000人以上,上市公司,1.2万-2.4万,本科,数据分析 Python Hive SQL BI 商业数据分析 ,3-5年
30,广州,金融数据分析师（双休+非销售）,广州瀚信信息咨询服务有限公司,100-299人,民营,4千-6千,大专,风险控制 数据分析 金融 数据研究员 ,不限
31,广州,人力资源数据分析师,纳思达,10000人以上,民营,2万-2.5万,本科,数据分析 数据挖掘 数据建模 ,3-5年
32,广州-越秀区,助理数据分析师,佰聆数据股份有限公司北京分公司,100-299人,民营,6千-8千,本科,数据分析 SQL Python 数据建模 ,不限
33,广州-荔湾区,数据分析师,名创优品,10000人以上,民营,1.5万-2.5万,本科,Python BI SQL Tableau 商业数据分析 需求分析 ,3-5年
34,广州-番禺区,数据分析师,雅生活集团,1000-9999人,上市公司,1万-1.5万,本科,数据分析 ,1-3年
35,广州-荔湾区,数据分析师,大参林,10000人以上,上市公司,8千-1.5万,本科,统计学 数据分析 ,3-5年
36,广州,高级数据分析师,棒谷科技,1000-9999人,民营,1万-1.8万,本科,数据建模 数据挖掘 SQL Python 用户画像 ,3-5年
37,广州-黄埔区,数据分析师（数据挖掘）,南方电网深圳数字电网研究院有限公司,1000-9999人,国企,1.5万-2万,本科,数据分析 数据挖掘 Python Hive 机器学习 ,3-5年
38,广州-荔湾区,商品数据分析师(加拿大),名创优品,10000人以上,民营,6千-1万,本科,数据分析 excel SQL ,1-3年
39,广州-番禺区,数据分析师,范可辛服饰(广州)有限公司,100-299人,民营,1万-2万,大专,数据分析 销售业务数据 ,3-5年
40,广州,数据运营分析师（CDA）,一品红,500-999人,上市公司,1万-1.5万,大专,数据采集 数据建模 ,3-5年
41,广州-天河区,数据分析师,深圳市鼎驰科技发展有限公司,100-299人,民营,1.2万-1.5万,本科,数据分析 ,1-3年
42,广州,数据分析师,广州市易工品科技有限公司,500-999人,民营,8千-1.2万,本科,SQL SPSS 数据分析 数据挖掘 商业数据分析 ,1-3年
43,广州-南沙区,数据分析师,成都音泰思科技有限公司,100-299人,民营,1万-2万,本科,数据分析 ,1-3年
44,广州,大数据分析师,中国联通广东分公司,1000-9999人,国企,1.5万-2.5万,本科,数据分析 商业数据分析 数据建模 ,1-3年
45,广州-黄埔区,数据分析师,广电运通,500-999人,国企,1万-1.5万,本科,数据分析 BI SPSS SQL ,1-3年
46,广州-黄埔区,电力数据分析师,润建智慧能源有限责任公司,1000-9999人,民营,5千-8千,大专,数据分析 Oracle SQL 数据建模 ,不限
47,广州,数据分析师（BI)）,青木数字技术股份有限公司,1000-9999人,民营,6千-8千,本科,商业分析 行业分析 数据建模 数据分析 电商数据 ,1-3年
48,广州-天河区,初级数据分析师/6K双休,广州帝诺科技有限公司,100-299人,民营,5千-8千,本科,数据分析 商业数据分析 大数据分析 BI ,不限
49,广州-增城区,大数据分析师,纽恩泰,500-999人,股份制企业,9千-1.7万,本科,数据分析 数据挖掘 决策树 大数据分析 爬虫 ,3-5年
50,广州-白云区,数据分析师,广东甜秘密寝具有限公司,500-999人,其它,6千-8千,大专,数据分析 MySQL 数据监控 大数据分析 SQL ,不限
51,广州,大数据分析师（保底10K＋双休）,广州帝诺科技有限公司,100-299人,民营,1万-2万,本科,数据分析 数据仓库 商业分析 MySQL Power BI Python 大数据分析 ,3-5年
52,广州-番禺区,数据分析师,蘑菇物联,100-299人,民营,2.2万-3万,本科,数据分析 数据挖掘 ,3-5年
53,广州,数据分析师,四川中天浩会计师事务所有限公司,20-99人,民营,5千-7千,本科,SQL ,不限
54,广州-天河区,业务数据分析师（周末双休10k以上）,广州帝诺科技有限公司,100-299人,民营,1万-1.5万,大专,数据分析 数据挖掘 BI 大数据分析 大数据平台 数据采集 Oracle SQL ,不限
55,广州-越秀区,数据分析师,中科金审,100-299人,民营,9千-1.4万,本科,数据挖掘 需求分析 数据建模 ,1-3年
56,广州,亚马逊选品专员（亚马逊数据分析师）,广州芒果尚品网络科技有限公司,20人以下,民营,1万-2万,大专,跨境电商运营 选品 亚马逊选品 ,1-3年
57,广州-天河区,数据分析运营师,广州帝诺科技有限公司,100-299人,民营,8千-1.5万,大专,数据分析 BI 数据仓库 大数据分析 大数据平台 ETL Oracle 数据采集 ,不限
58,广州-天河区,数据分析师,软通动力信息技术(集团)股份有限公司,10000人以上,民营,8千-1万,本科,数据分析 SQL 大数据平台 数据仓库 ,3-5年
59,广州,数据分析师,广州粒粒金团企业管理顾问有限公司,20-99人,民营,1万-1.5万,本科,需求分析 SQL Python ,3-5年
60,广州,数据分析师,广东铭太信息科技有限公司,100-299人,民营,4千-8千,本科,数据统计分析 ,不限
61,广州-天河区,数据分析师,信必优(深圳)信息技术有限公司,500-999人,外商独资,面议,本科,数据分析 SQL 数据建模 ETL 大数据分析 ,3-5年
62,广州,数据分析师,北京字节跳动科技有限公司,10000人以上,民营,2.5万-5万,本科,,5-10年
63,广州-越秀区,数据分析师,广州市星月动漫文化发展有限公司,20-99人,民营,5千-8千,本科,品牌商沟通 货品运营 ,1-3年
64,广州-越秀区,数据分析师,广东二十一世纪传媒股份有限公司,500-999人,国企,1.3万-2.5万,本科,数据分析 ,1-3年
65,广州-海珠区,业务数据分析师,药师帮,1000-9999人,民营,1万-1.5万,本科,数据分析 ,1-3年
66,广州,数据分析师,义乌市宁姿服饰有限公司,20-99人,民营,1万-1.5万,大专,行业数据分析 电商数据运营 推广数据运营 Python 建模 CDA ,3-5年
67,广州-天河区,数据运营专员/数据分析师,广东携众建筑咨询服务有限公司,1000-9999人,股份制企业,7千-1万,本科,行业数据分析 业务数据分析 销售业务分析 ,1-3年
68,广州,商业数据分析师,广州乐佩贸易有限公司,20人以下,民营,6千-8千,大专,商业分析 数据挖掘 Python ,不限
69,广州,阿里灵犀互娱-游戏数据分析师-广州,阿里巴巴集团,10000人以上,合资,面议,本科,,无经验
70,广州,数据分析师,文思海辉技术有限公司 Pactera Technology International Limited,1000-9999人,外商独资,面议,本科,,1-3年
71,广州-番禺区,数据分析师（销售策略）,百度在线网络技术(北京)有限公司上海软件技术分公司,1000-9999人,上市公司,1万-1.5万,本科,数据运营 数据分析师 销售数据分析 策略运营 ,3-5年
72,广州-番禺区,统计数据分析师,广州市番禺区陈文卫会计培训中心,100-299人,民营,4千-6千,大专,office 统计软件 ,1-3年
73,广州,游戏数据分析师,广州四三九九信息科技有限公司,1000-9999人,民营,8千-1.5万,本科,游戏数据运营 行业数据分析 推广数据运营 ,不限
74,广州-花都区,直播数据分析师,广州妆后贸易有限公司,100-299人,民营,6千-8千,学历不限,主播 直播 数据分析 直播分析 直播运营 ,1-3年
75,广州-白云区,XA2170-数据分析师（物流）,顺丰速运,20-99人,民营,2.5万-3.5万,本科,数据分析师（物流） ,5-10年
76,广州-花都区,数据分析师（偏数据挖掘）,法本信息,1000-9999人,上市公司,1万-1.5万,大专,Python 数据清洗 SQL R语言 Tableau ,3-5年
77,广州,金融数据分析师（双休）,广东兆丰恒业控股集团有限公司,1000-9999人,民营,4千-6千,大专,风险分析 ,1年以下
78,广州,电商数据分析师/高级数据分析专员/天猫数据分析师,名创优品,10000人以上,民营,1.2万-1.8万,本科,电商数据运营 ,3-5年
79,广州-海珠区,数据运营分析师,广州凡科互联网科技股份有限公司,500-999人,上市公司,1万-2万,本科,SPSS SQL 行业数据分析 ,1-3年
80,广州-天河区,数据分析员,广东科慧信息服务股份有限公司,1000-9999人,民营,9千-1.1万,本科,数据分析 SQL SQL Server ,1-3年
81,广州-黄埔区,数据支持岗,京东物流华南区域分公司,1000-9999人,外商独资,8千-1.5万,大专,数据分析 数据挖掘 Python BI SQL 商业数据分析 ,1-3年
82,广州-黄埔区,数据分析师,佰聆数据股份有限公司北京分公司,100-299人,民营,1万-1.5万,本科,数据分析 数据挖掘 SQL Python R语言 ,1-3年
83,广州-海珠区,数据运营,广州欧莱雅百库网络科技有限公司,1000-9999人,外商独资,7千-1.1万,本科,数据分析 数据监控 Python SPSS BI SQL ,1-3年
84,广州,数据分析师,广东铭太信息科技有限公司,100-299人,民营,3千-5千,大专,数据分析 MySQL Python ,不限
85,广州-黄埔区,人力资源数据分析主管/经理,京东物流华南区域分公司,1000-9999人,外商独资,1万-2万,本科,数据分析 BI MySQL ,3-5年
86,广州,（金融）数据分析师助理（周末双休+朝九晚五）,广东兆丰恒业控股集团有限公司,1000-9999人,民营,8千-1万,大专,金融 数据 实习生 应届生 双休 朝九晚五 管培生 分析 ,不限
87,广州-天河区,数据挖掘分析师（2021届）,深圳索信达数据技术有限公司,500-999人,上市公司,8千-1.5万,硕士,数据清洗 数据建模 Python SQL SPSS ,无经验
88,广州-黄埔区,助理数据分析师,佰聆数据股份有限公司北京分公司,100-299人,民营,2千-3千,本科,数据分析 需求分析 数据清洗 大数据平台 SQL Python R语言 ,1年以下
89,广州-天河区,贝壳找房-广州站-数据分析岗【2021届ADC】校园招聘,贝壳找房,10000人以上,上市公司,9千-1.3万,本科,数据分析 SQL SPSS ,不限
90,广州-海珠区,数据专员/数据分析师,健丽科技投资,500-999人,民营,4千-6千,大专,,1-3年
91,广州,国际化广告数据分析师,北京字节跳动科技有限公司,10000人以上,民营,1万-2万,本科,,1-3年
92,广州,大数据分析师(J11336),汉得信息,10000人以上,上市公司,8千-1万,大专,Tableau 数据分析 数据挖掘 数据清洗 ,3-5年
93,广州-天河区,数据采集分析,广州仅悦数据科技有限公司,20-99人,民营,6千-1.2万,本科,数据采集 数据治理 数据仓库 数据分析 ,1-3年
94,广州,数据分析工程师,丰石科技,100-299人,民营,6千-8千,大专,SQL ,1-3年
95,广州-天河区,数据分析专员,广州达信数据科技有限公司,20-99人,其它,6千-1.1万,大专,Tableau 数据分析 SQL ,1-3年
96,广州-海珠区,广东铁塔站址运营管理员（QD31）,广东邮电人才服务有限公司广州分公司,10000人以上,国企,8千-9千,大专,数据分析 运营 数据 通信 管理 分析 ,1-3年
97,广州-天河区,YP数据专员（周末双休、五险一金）,北京易速聘人力资源有限公司,500-999人,股份制企业,5.5千-7.5千,本科,数据分析 ,1-3年
98,广州-天河区,数据分析员,广州仅悦数据科技有限公司,20-99人,民营,6千-1.2万,大专,SQL BI R语言 ,1-3年
99,广州-越秀区,数据分析助理,广州生煎先生餐饮有限公司,100-299人,民营,4千-6千,大专,数据分析 数据挖掘 需求分析 商业数据分析 ,不限
100,广州-天河区,双休数据分析专员/助理,广州达信数据科技有限公司,20-99人,其它,6千-8千,大专,数据运维 数据分析 ,不限
101,广州,数据挖掘分析师,北京字节跳动科技有限公司,10000人以上,民营,1万-2万,本科,,3-5年
102,广州,数据分析专员/助理,广东康爱多数字健康科技有限公司,1000-9999人,民营,5千-8千,本科,Python 数据分析 商业数据分析 R语言 SQL 数据建模 模型设计 大数据分析 ,1年以下
103,广州,数据分析专员 4k-6k+五险一金,魔方网聘(北京)科技有限公司广州分公司,500-999人,民营,6千-8千,大专,数据分析 ,不限
104,广州,经济数据分析员（8k+双休）,广州瀚信信息咨询服务有限公司,100-299人,民营,8千-1万,大专,数据分析 行业分析 需求分析 ,不限
105,广州-海珠区,数据分析助理,中国秦发集团有限公司,1000-9999人,民营,6千-8千,本科,数据分析 数据挖掘 大数据分析 数据建模 数据监控 行业分析 需求分析 数据采集 ,1-3年
106,广州-天河区,数据分析专员 4k-6k+五险一金,秋小香(成都)科技有限公司,20-99人,民营,6千-8千,大专,数据分析 ,不限
107,广州-天河区,数据分析,广东铭太信息科技有限公司,100-299人,民营,4千-8千,本科,数据分析 BI 大数据分析 SQL ,1-3年
108,广州,数据专员（可应届生）,广州市欧亮照明有限公司,20-99人,民营,4千-8千,大专,数据分析 商业数据分析 数据采集 需求分析 商业分析 电商数据分析 ,不限
109,广州,数据分析助理（双休+弹性工作）,广州瀚信信息咨询服务有限公司,100-299人,民营,8千-1万,大专,数据分析 行业分析 需求分析 ,不限
110,广州-番禺区,数据分析员（应届毕业生也可）,广东腾达庆红汽车有限公司,20-99人,民营,5千-7千,大专,数据分析 数据挖掘 数据清洗 数据监控 深度学习 需求分析 行业分析 数据建模 ,1-3年
111,广州-白云区,数据分析专员,上海本来生活信息科技有限公司,1000-9999人,民营,8千-1万,本科,数据分析 数据挖掘 Python BI SPSS SQL ,3-5年
112,广州-白云区,大数据分析助理/双休带薪年假,广州天河区泉乐共享科技有限公司,20-99人,民营,6千-9千,大专,数据仓库 数据处理 ,1年以下
113,广州-天河区,公众号数据分析,深圳市睿服科技有限公司,500-999人,股份制企业,4千-6千,大专,SQL ,1-3年
114,广州,金融数据分析（8K+完善晋升+双休）,广州瀚信信息咨询服务有限公司,100-299人,民营,8千-1万,大专,风险控制 数据分析 金融 ,不限
115,广州,数据分析助理,广东兆丰恒业控股集团有限公司,1000-9999人,民营,6千-8千,大专,朝九晚五 管培生 实习生 投资助理 证券研究 金融 数据分析 分析师助理 ,不限
116,广州,校招-数据分析挖掘工程师(J12575),东方国信,1000-9999人,上市公司,3千-5千,本科,数据分析 数据挖掘 ,不限
117,广州,零售银行商业分析助理副总裁（恒生）,汇丰环球,10000人以上,外商独资,2.5万-5万,本科,PEGA GCP AEM ,5-10年
118,广州-海珠区,数据智能高级主管/助理经理,广州欧莱雅百库网络科技有限公司,1000-9999人,外商独资,1万-2万,本科,Python SQL 数据建模 ,3-5年
119,广州-天河区,初级开发工程师/薪资6-10K＋/福利待遇好/有晋升渠道,广州达信数据科技有限公司,20-99人,其它,6千-1万,大专,数据分析 ,1-3年
120,广州,数据分析专员,广州彼特技术有限公司,20-99人,股份制企业,4千-7千,大专,数据分析 ,不限
121,广州,数据分析主管 #4185192,Michael Page,1000-9999人,外商独资,面议,本科,,无经验
122,广州-海珠区,数据处理实习生,广州市赛皓达智能科技有限公司,100-299人,民营,2千-3千,大专,数据处理实习生 ,不限
123,广州,数据分析专员,置家集团,1000-9999人,合资,6千-1万,本科,Python SQL Tableau Oracle 数据分析 数据清洗 ,1-3年
124,广州-天河区,Excel数据分析（6K+双休）,广州达信数据科技有限公司,20-99人,其它,5千-8千,本科,数据分析 BI ,不限
125,广州-天河区,数据分析岗,广州贝壳,1000-9999人,民营,8千-1.2万,本科,数据分析 数据挖掘 数据清洗 SQL SPSS 数据监控 ,不限
126,广州,高级数据分析-美资消费品巨头 #4187086,Michael Page,1000-9999人,外商独资,面议,本科,SQL excel Python ,3-5年
127,广州,数据分析工程师,深圳市南电云商有限公司,100-299人,民营,1万-2万,本科,大数据分析 ,不限
128,广州,商品主管/商品计划分析师,名创优品,10000人以上,民营,1万-1.5万,本科,统计学 商品计划 ,3-5年
129,广州,初级数据分析助理 6-8K,广州达信数据科技有限公司,20-99人,其它,6千-8千,大专,数据分析 Tableau BI SQL ,1-3年
130,广州-天河区,数据分析专员,广州市优贝教育科技有限公司,100-299人,民营,8千-1.5万,本科,数据分析 ,1-3年
131,广州,数据分析员/数据专员,广州巴伽娱乐传媒有限公司,100-299人,合资,5千-1万,本科,数据分析 ,1-3年
132,广州-天河区,数据分析助理（周末双休）,广州帝诺科技有限公司,100-299人,民营,8千-1.5万,大专,数据分析 数据挖掘 BI ETL 数据采集 大数据平台 大数据分析 数据仓库 ,不限
133,广州,零售银行商业分析经理（恒生）,汇丰环球,10000人以上,外商独资,1万-2万,本科,数据分析 金融 ,3-5年
134,广州,计划数据分析/计划统筹(J10270),林氏木业,1000-9999人,民营,7千-9千,本科,数据挖掘 商业分析 数据采集 ,3-5年
135,广州,数据处理员（可实习）,广州仓实信息科技有限公司,20-99人,民营,4千-6千,学历不限,不动产 数据分析 数据处理 excel 档案整理核对 数据内业 ,不限
136,广州,数据分析工程师（双休+14薪）,广州中港科技有限公司,100-299人,民营,6千-8千,大专,数据分析 大数据分析 数据清洗 数据监控 数据采集 ,1年以下
137,广州-南沙区,数据分析与挖掘实习生（中科智城）,广州中国科学院软件应用技术研究所,100-299人,事业单位,1.5千-2.5千,本科,数据分析 数据仓库 大数据分析 大数据平台 数据监控 数据采集 回归分析 数据架构 ,不限
138,广州,数据分析员+五险一金,广州帝诺科技有限公司,100-299人,民营,6千-1.2万,大专,excel SQL ,1-3年
139,广州,数据工程师,广州市华广计算机软件有限公司,20-99人,其它,5千-9千,大专,数据分析 ,1-3年
140,广州-黄埔区,数据实习生,广州宏途教育网络科技有限公司,100-299人,民营,2千-3千,大专,数据分析 ,1-3年
141,广州-南沙区,售后坏件分析员,广东芬尼克兹节能设备有限公司,1000-9999人,民营,5千-7千,大专,数据分析 数据建模 数据采集 ,1-3年
142,广州-天河区,业务数据员 均6k+ 双休 朝九晚六 五险一金,辽宁人瑞普惠人力资源服务有限公司,100-299人,民营,6千-8千,大专,数据分析 Python 需求分析 数据挖掘 行业分析 ,不限
143,广州-天河区,双休数据分析专员/助理（包吃住）,广州帝诺科技有限公司,100-299人,民营,5千-8千,本科,技术 助理 数据分析 大数据分析 ,不限
144,广州-白云区,数据分析(东呈会),东呈国际集团,10000人以上,民营,1万-1.3万,本科,数据分析 收益管理 ,1-3年
145,广州-荔湾区,数据分析实习生（企业运营方向）,广州医药股份有限公司,1000-9999人,合资,2千-3千,学历不限,数据分析 运营 项目管理 ,不限
146,广州-天河区,数据分析专员,广州鹰金钱食品集团有限公司,500-999人,国企,3千-5千,大专,数据分析 数据仓库 ,1-3年
147,广州-黄埔区,数据处理员-餐补-五险一金-绩效奖金,辽宁人瑞普惠人力资源服务有限公司,100-299人,民营,7千-9千,大专,数据分析 需求分析 数据监控 数据挖掘 ,不限
148,广州-天河区,数据员,广东省家庭医生协会,20-99人,其它,7千-1.4万,大专,数据分析 ,1-3年
149,广州,数据分析助理,广州帝诺科技有限公司,100-299人,民营,6千-1万,大专,SQL ,1-3年
150,广州,数据分析员（应届毕业生也可）,广东腾达庆红汽车有限公司,20-99人,民营,5千-7千,大专,数据分析 数据挖掘 数据清洗 数据监控 深度学习 需求分析 行业分析 数据建模 ,1-3年
151,广州-天河区,SAP数据专员,亿达信息技术有限公司深圳分公司,1000-9999人,民营,6千-9千,本科,SAP 数据处理 excel 英语能力 Power BI 数据透视 主数据系统 ,1-3年
152,广州-天河区,数据分析专员/双休,广州达信数据科技有限公司,20-99人,其它,7千-1万,本科,SQL 商业数据分析 需求分析 数据清洗 数据分析 ,1-3年
153,广州,营销数据分析经理(J10274),深圳前海新心数字科技有限公司,500-999人,民营,2万-3万,本科,数据分析 ,5-10年
154,广州-天河区,数据分析员/8K以上,广州帝诺科技有限公司,100-299人,民营,8千-1.5万,大专,数据分析 数据挖掘 BI 大数据分析 大数据平台 ETL SQL ,不限
155,广州-天河区,AI智能训练师（偏客服和数据）,深圳前海云彩投资有限公司,100-299人,国企,8千-1.2万,大专,客服管理 在线客服 售后客服 投诉客服 客服质检 售前客服 ,1-3年
156,广州,数据运营,深圳科迪新汇信息科技有限公司广州分公司,100-299人,民营,8千-1.5万,大专,数据分析 数据挖掘 ,1-3年
157,广州-天河区,数据治理工程师,广州宝巨信息技术有限公司,20-99人,民营,1.5万-3万,本科,数据建模 数据治理 数据分析 数据中台 大数据平台 ,3-5年
158,广州-天河区,数据分析,彩讯科技,1000-9999人,民营,7千-1.2万,本科,数据分析 Python SQL SPSS ,3-5年
